{
  "$schema": "https://json-schema.org/draft/2020-12/schema",
  "$id": "https://handoffkit.dev/schemas/training-job.schema.json",
  "title": "TrainingJob",
  "type": "object",
  "required": ["job_id", "dataset", "output", "config", "requested_capabilities", "idempotency_key", "metadata"],
  "properties": {
    "job_id": { "type": "string", "minLength": 1 },
    "dataset": { "$ref": "artifact-ref.schema.json" },
    "output": { "type": "string", "minLength": 1 },
    "config": { "type": "object" },
    "requested_capabilities": { "type": "array", "items": { "type": "string" } },
    "deadline": { "type": ["string", "null"], "format": "date-time" },
    "idempotency_key": { "type": "string", "minLength": 1 },
    "metadata": { "type": "object" }
  },
  "additionalProperties": true
}
